{
  "$defs": {
    "CandidateSummaryV1": {
      "description": "Compact candidate summary for list views.",
      "properties": {
        "allocated_bytes": {
          "format": "uint64",
          "minimum": 0,
          "type": "integer"
        },
        "candidate_id": {
          "type": "string"
        },
        "category": {
          "type": "string"
        },
        "display_path": {
          "type": "string"
        },
        "reclaim_estimate_bytes": {
          "format": "uint64",
          "minimum": 0,
          "type": "integer"
        },
        "reconstructable": {
          "type": "boolean"
        },
        "risk": {
          "type": "string"
        }
      },
      "required": [
        "candidate_id",
        "display_path",
        "category",
        "risk",
        "allocated_bytes",
        "reclaim_estimate_bytes",
        "reconstructable"
      ],
      "type": "object"
    }
  },
  "$schema": "https://json-schema.org/draft/2020-12/schema",
  "description": "Paginated candidate list response.",
  "properties": {
    "items": {
      "items": {
        "$ref": "#/$defs/CandidateSummaryV1"
      },
      "type": "array"
    },
    "limit": {
      "format": "uint",
      "minimum": 0,
      "type": "integer"
    },
    "next_cursor": {
      "type": [
        "string",
        "null"
      ]
    },
    "schema_version": {
      "type": "string"
    },
    "total_count": {
      "format": "uint",
      "minimum": 0,
      "type": "integer"
    }
  },
  "required": [
    "schema_version",
    "items",
    "total_count",
    "limit"
  ],
  "title": "CandidateListResponseV1",
  "type": "object"
}
